{
  "type": "slaif.maintainerHpcTestConfig",
  "version": 1,
  "system": "nsc",
  "loginHostCandidates": [
    "nsc-login.ijs.si"
  ],
  "selectedLoginHost": "REPLACE_ME",
  "username": "REPLACE_ME",
  "sshKeyPath": "~/.ssh/id_ed25519",
  "verifiedKnownHostsFile": "REPLACE_ME",
  "remoteBaseDir": "~/.slaif-connect/hpc-tests",
  "slurm": {
    "account": "",
    "cpuPartition": "",
    "gpuPartition": "",
    "qos": "",
    "timeLimit": "00:05:00",
    "memory": "1G",
    "cpusPerTask": 1,
    "gpus": 1,
    "gpuGres": ""
  },
  "tests": {
    "runCpuDiagnostics": true,
    "runGpuDiagnostics": false,
    "runLauncherDryRun": true,
    "runLauncherIntentDryRun": true,
    "runLauncherIntentSubmit": false,
    "launcherIntentPayloadId": "cpu_memory_diagnostics_v1",
    "runYolo": false
  },
  "yolo": {
    "command": "",
    "allowYolo": false,
    "iUnderstandThisRunsArbitraryCode": false
  }
}
